36,Assistant API,Start task,src/frontend/src/services/assistantTaskService.ts,Assistant bắt đầu làm task,Nút start task,startAssistantTask(taskId,assistantEmail),API_BASE_URL,PUT,/api/assistant/tasks/{taskId}/start,AssistantTaskController.java,start(taskId, request),InMemoryMangakaProductionService.java,startAssistantTask(); Pending/RedoRequested -> InProgress; check đúng assistant,AssistantTaskActionRequest; AssistantTaskDto,TaskEntity; tasks,"Start task đổi status gì?","Backend đổi từ Pending hoặc RedoRequested sang InProgress."
37,Assistant API,Submit task,src/frontend/src/services/assistantTaskService.ts,Assistant nộp kết quả task,Submit form: submittedFileName/submissionNote,submitAssistantTask(taskId,assistantEmail,file,note),API_BASE_URL,PUT,/api/assistant/tasks/{taskId}/submit,AssistantTaskController.java,submit(taskId, request),InMemoryMangakaProductionService.java,submitAssistantTask(); InProgress -> Submitted; lưu submission info,AssistantTaskSubmitRequest; AssistantTaskDto,TaskEntity; SubmissionEntity; tasks; submissions,"Submit task lưu gì?","Lưu submittedFileName, note, submittedAt và đổi task status sang Submitted để mangaka review."
38,Download file,Manuscript download link,TantouEditorDashboard.tsx; EditorialBoardDashboard.tsx,Tạo link tải manuscript để editor/board xem file,Nút/link download manuscript,getManuscriptDownloadUrl(fileName),API_BASE_URL,GET,/api/mangaka/proposals/files/{fileName},MangakaProposalController.java,download(fileName),MangakaProposalController.java,Đọc file từ storage-server/manuscripts; fallback path cũ ~/swp391-uploads/manuscripts,Resource download response,storage-server/manuscripts,"Download manuscript đi qua controller nào?","Link dùng endpoint GET /api/mangaka/proposals/files/{fileName}, controller trả Resource file từ storage-server/manuscripts."
39,Config,Base URL in services,src/frontend/src/services/*.ts,Cấu hình nơi frontend gọi backend,Mỗi service tự khai báo API_BASE_URL,Tất cả service functions,import.meta.env.VITE_API_BASE_URL ?? http://localhost:8080,Tất cả,Tất cả backend endpoints,Tất cả controllers,Tất cả methods,Tùy module,Tùy module,Tùy module,"Nếu đổi backend port/domain thì sửa đâu?","Set VITE_API_BASE_URL trong env frontend; nếu không set thì service mặc định gọi http://localhost:8080."
40,Backend config,Storage config,src/backend/src/main/resources/application.properties; application-local.properties,Cấu hình nơi lưu file upload backend,Không phải component UI,Không có,MANUSCRIPT_STORAGE_DIR hoặc app.storage.manuscripts-dir,N/A,N/A,MangakaProposalController.java,upload(); download(); manuscriptStorageDirectory(),MangakaProposalController.java,default storage-server/manuscripts; có fallback legacy download,Không có,storage-server/manuscripts,"File upload backend lưu vào đâu?","Mặc định lưu vào storage-server/manuscripts, có thể đổi bằng MANUSCRIPT_STORAGE_DIR."
41,ERD/DB,Auth/account tables,schema.sql; database.txt,Lưu user/role/permission/skill,Không phải component UI,N/A,N/A,N/A,N/A,N/A,N/A,Account/auth services,Quan hệ users-roles-skills,UserEntity; RoleEntity; SkillEntity; UserSkillEntity,users; roles; permissions; role_permissions; skills; user_skills,"Auth liên quan bảng nào?","users lưu account, roles lưu role, user_skills nối user với skill; permission tables phục vụ phân quyền."
42,ERD/DB,Proposal workflow tables,schema.sql; database.txt,Lưu proposal/series/board vote,Không phải component UI,N/A,N/A,N/A,N/A,N/A,N/A,InMemoryMangaProposalService,Status proposal và board voting,SeriesEntity; BoardVoteEntity,series hoặc series; board_votes,"Proposal liên quan bảng nào?","Proposal/series lưu thông tin manga proposal; board_votes lưu từng phiếu của board member."
43,ERD/DB,Production/task tables,schema.sql; database.txt,Lưu chapter/page/task/submission/annotation,Không phải component UI,N/A,N/A,N/A,N/A,N/A,N/A,InMemoryMangakaProductionService,Task state machine,MangakaChapterDto; PageDto; TaskDto; Submission DTO,chapters; pages; tasks; submissions; annotations,"Production liên quan bảng nào?","chapters/pages lưu sản phẩm, tasks lưu việc giao assistant, submissions lưu kết quả assistant nộp, annotations/regions lưu vùng trên page."
44,Demo flow,Newman/Postman collection,postman/manga-workflow-flow.postman_collection.json,Test tự động toàn bộ flow backend 15 API,Không phải React component,npm run test:api,http://localhost:8080,15 requests,Nhiều endpoint auth/proposal/editor/board/production/assistant,Nhiều controllers,Nhiều methods,Nhiều services,Check 30 assertions status code/status data,Tất cả DTO chính,Tất cả table chính trong flow,"Làm sao chứng minh backend chạy đúng?","Chạy npm run test:api; nếu 15 requests và 30 assertions đều failed 0 thì flow backend pass end-to-end."
45,Status flow,Proposal status enum,src/backend/src/main/java/com/mangaworkflow/domain/proposal/MangaProposalStatus.java,Định nghĩa các trạng thái proposal,Frontend dùng type MangaProposalStatus trong src/frontend/src/types/mangaka.ts,N/A,N/A,N/A,N/A,N/A,N/A,InMemoryMangaProposalService.java,Status chính: Draft -> SubmittedToEditor -> UnderBoardReview -> Approved/Rejected/NeedsRevision/Serializing,MangaProposalStatus,SeriesEntity.status,"Cô hỏi status proposal chạy thế nào?","Mangaka tạo Draft, submit thành SubmittedToEditor, editor forward thành UnderBoardReview, board vote đủ thì Approved hoặc Rejected; editor có thể request NeedsRevision."
